{
  "schemaVersion": "cautilus.skill_test_cases.v1",
  "skillId": "cautilus",
  "skillDisplayName": "cautilus",
  "cases": [
    {
      "caseId": "trigger-cautilus-test-request",
      "evaluationKind": "trigger",
      "prompt": "Use $cautilus to test the local impl skill with the checked-in fixture and report the exact command path and recommendation.",
      "expectedTrigger": "must_invoke"
    },
    {
      "caseId": "execution-cautilus-test-request",
      "evaluationKind": "execution",
      "prompt": "Use $cautilus to test the local impl skill with the checked-in fixture at ./fixtures/skill-evaluation/input.json and summarize the recommendation.",
      "thresholds": {
        "max_duration_ms": 120000
      }
    }
  ]
}
